{
  "artifact_id": "BIND-m1_s4_shared",
  "schema_version": "0.1",
  "source_chain": {
    "cqs_id": "CQS-CQC-P2-04",
    "cqs_sha256": "ba34208d5ba862e7bdf4498ebe19efcee87efe695c4b61200fe573f1dcef2c15",
    "srp_id": "SRP-CQC-P3-04",
    "srp_sha256": "03355816136dd52e66e70f7c92125386bf62c5ee1d57bd2e9a30f0ecad0cad31",
    "budget_envelope_id": "BE-CQC-P4-S4",
    "budget_envelope_sha256": "47ac0a82624d616baa568c2e49ff8c89860b00f61f7d8cf2faf42686e3f2b442"
  },
  "mafs_baseline": {
    "repository": "mo21cn/mafs-v3-p0",
    "commit_sha": "cd09699fc8cc160ab5cfff00a41e714961dd2109",
    "interface_state": "MAFS v3.0-P1.5-RA3 closed execution-boundary state"
  },
  "active_routes": [
    {
      "requirement_id": "R01",
      "route_id": "entity_resource_identity",
      "allocation_id": "AL01",
      "allocation_activation": "COMMITTED",
      "mafs_axis_id": "A1",
      "mafs_search_order_ids": [
        "SO-A1-1"
      ]
    },
    {
      "requirement_id": "R02",
      "route_id": "measurement_observability",
      "allocation_id": "AL02",
      "allocation_activation": "COMMITTED",
      "mafs_axis_id": "A2",
      "mafs_search_order_ids": [
        "SO-A2-1"
      ]
    }
  ],
  "held_conditional_routes": [
    {
      "requirement_id": "R03",
      "route_id": "source_content_verification",
      "allocation_id": "AL03",
      "activation": "RESERVE_CONDITIONAL"
    }
  ],
  "unfunded_required_routes": [],
  "status": "READY_FOR_MAFS_PREFLIGHT",
  "stale_state": "CURRENT"
}
