{
  "artifact_id": "BIND-s1_vms_cellular_mechanism",
  "schema_version": "0.1",
  "source_chain": {
    "cqs_id": "CQS-CQC-P2-01-R1",
    "cqs_sha256": "92305bf11f989cf22a0a8121e5705c74028c0fce0c785352c65715a05bcb31e7",
    "srp_id": "SRP-CQC-P3-01",
    "srp_sha256": "67755617b29aef2f3d80f53b20fb9fb2434fe8512a4dae5472fe9263e83380ea",
    "budget_envelope_id": "BE-CQC-P4-S1-R2",
    "budget_envelope_sha256": "60bb9ab99598389419b31f1b2f9ac65ed1dd82bec54f05102eddbc28d16c958e"
  },
  "mafs_baseline": {
    "repository": "mo21cn/mafs-v3-p0",
    "commit_sha": "cd09699fc8cc160ab5cfff00a41e714961dd2109",
    "interface_state": "MAFS v3.0-P1.5-RA3 closed execution-boundary state"
  },
  "active_routes": [
    {
      "requirement_id": "R01",
      "route_id": "mechanism_evidence",
      "allocation_id": "AL01",
      "allocation_activation": "COMMITTED",
      "mafs_axis_id": null,
      "mafs_search_order_ids": []
    },
    {
      "requirement_id": "R03",
      "route_id": "measurement_observability",
      "allocation_id": "AL02",
      "allocation_activation": "COMMITTED",
      "mafs_axis_id": null,
      "mafs_search_order_ids": []
    }
  ],
  "held_conditional_routes": [
    {
      "requirement_id": "R02",
      "route_id": "mechanism_evidence",
      "allocation_id": "AL03",
      "activation": "RESERVE_CONDITIONAL"
    },
    {
      "requirement_id": "R02",
      "route_id": "counterexample_negative_evidence",
      "allocation_id": "AL04",
      "activation": "RESERVE_CONDITIONAL"
    }
  ],
  "unfunded_required_routes": [],
  "status": "READY_FOR_MAFS_PREFLIGHT",
  "stale_state": "CURRENT"
}
